{
  "schema_version": "0.3",
  "run_id": "run-1",
  "created_at": "2026-10-19T18:30:00Z",
  "canonicalization": "RFC8785",
  "retention": {
    "raw_days": 90,
    "redacted_days": 365
  },
  "entries": [
    {
      "evidence_id": "call-0042",
      "case_id": "CT-ASM-001",
      "kind": "harness_call",
      "raw_ref": "evidence://call-0042.json",
      "raw_sha256": "daec4ba069f441e9ac82cb854de5d3becc02706ea9d86dcf1a7a0e53635d2f68",
      "raw_size": 512,
      "redacted_ref": "evidence://call-0042.redacted.json",
      "redacted_sha256": "678a81b89c1a9519f2144b3f9686be5e7fcf283ca5983a6cdbe4d5a9fa829e0d",
      "redaction_policy": "redact-v1",
      "collected_at": "2026-10-19T18:00:00Z"
    },
    {
      "evidence_id": "res-0101",
      "case_id": "CT-CFG-025.05",
      "kind": "sut_response",
      "raw_ref": "evidence://res-0101.json",
      "raw_sha256": "764011bcf860a6cb78c7d8c8c8f4a4ef484cefebda59d27883e209eaf5899321",
      "raw_size": 233,
      "redaction_policy": "redact-v1",
      "collected_at": "2026-10-19T18:01:00Z"
    }
  ],
  "manifest_sha256": "6df57a21d6df3ac74d4c498600b57373fb08f7367a6eb7be401b2c4b3c992c51"
}
